{
  "schema_version": "1.0",
  "dataset_name": "Routiq AI Coach FAQ",
  "language": "en-IN",
  "updated_on": "2026-10-11",
  "total_questions": 255,
  "fields": {
    "id": "Existing Routiq sample-question ID",
    "category": "FAQ category from the source intent",
    "question": "Original user-facing sample question preserved verbatim",
    "answer": "Authored sample answer for current implementation and approved design limits",
    "intent_id": "Existing controlled intent ID",
    "link_text": "Optional CTA label; omitted when no confirmed destination exists",
    "url": "Optional confirmed destination; omitted when unavailable"
  },
  "metadata": {
    "version": "0.1",
    "status": "REVIEW",
    "answer_policy": "CURRENT_IMPLEMENTATION_WITH_EXPLICIT_DESIGN_AND_PRODUCT_LIMITS",
    "source_config": "routiq_chatbot.json",
    "source_config_version": "0.2.0",
    "source_sha256": "9ba2027729a85e1821f806e3fb6cfc74fef1ab95427cbfab402c6fc288fe0f15",
    "reference_notebook": "octakidz_faq_assistant.ipynb, embedded JSON in cell 6",
    "note": "Derived sample-answer dataset. Reference structure only; no OctaKidz answers copied. Personal habit data is not connected. No fabricated metrics or unapproved rules. The Coach does not automatically load this FAQ."
  },
  "questions": [
    {
      "id": "Q-001",
      "category": "Getting Started",
      "question": "What should I do first?",
      "answer": "Start with a small action you want to repeat and attach it to an existing routine. I can help plan an optional experiment, but this chat cannot save a habit.",
      "intent_id": "GETTING_STARTED"
    },
    {
      "id": "Q-002",
      "category": "Getting Started",
      "question": "How does Routiq work?",
      "answer": "Routiq is designed to help you plan habits, record activity, review progress and explore improvements. This Coach currently provides general advice; personal records are not connected.",
      "intent_id": "GETTING_STARTED"
    },
    {
      "id": "Q-003",
      "category": "Getting Started",
      "question": "Can you help me start a routine?",
      "answer": "Tell me the routine you want to build and an existing activity that could serve as a cue. We can explore a manageable starting action.",
      "intent_id": "GETTING_STARTED"
    },
    {
      "id": "Q-004",
      "category": "Getting Started",
      "question": "What habits should I track first?",
      "answer": "Choose a habit that matters to you and fits your circumstances, such as reading after a regular daily activity. I cannot select habits from a personal profile here.",
      "intent_id": "GETTING_STARTED"
    },
    {
      "id": "Q-005",
      "category": "Getting Started",
      "question": "How many habits should I start with?",
      "answer": "Start with a manageable set of habits rather than changing everything at once. I cannot prescribe a personalized count or an unapproved Routiq limit.",
      "intent_id": "GETTING_STARTED"
    },
    {
      "id": "Q-006",
      "category": "Getting Started",
      "question": "Where do I see my habits?",
      "answer": "In the approved design, Today shows scheduled habits and Habit Detail focuses on an individual habit. This notebook does not retrieve your saved habits.",
      "intent_id": "GETTING_STARTED"
    },
    {
      "id": "Q-007",
      "category": "Getting Started",
      "question": "How do I check off a habit?",
      "answer": "The approved prototype illustrates marking a habit complete from Today. This Coach cannot save completions, and a prototype interaction does not confirm a real record.",
      "intent_id": "GETTING_STARTED"
    },
    {
      "id": "Q-008",
      "category": "Getting Started",
      "question": "What can you help me with?",
      "answer": "I can discuss general habit ideas, routines and optional experiments. Personal progress, habit changes and saved conversation memory are not connected yet.",
      "intent_id": "GETTING_STARTED"
    },
    {
      "id": "Q-009",
      "category": "Getting Started",
      "question": "Do I have enough data for insights?",
      "answer": "I cannot assess your history because it is not connected. Minimum-data rules for insights are also still TBD_PRODUCT_DECISION.",
      "intent_id": "GETTING_STARTED"
    },
    {
      "id": "Q-010",
      "category": "Getting Started",
      "question": "What should I focus on today?",
      "answer": "Choose a manageable action that matters to you. I cannot prioritize your actual scheduled habits without access to your Today records.",
      "intent_id": "GETTING_STARTED"
    },
    {
      "id": "Q-011",
      "category": "Today Overview",
      "question": "What do I have to do today?",
      "answer": "I cannot list your actual activities for today because your habit schedules are not connected.",
      "intent_id": "TODAY_OVERVIEW"
    },
    {
      "id": "Q-012",
      "category": "Today Overview",
      "question": "Show my habits for today.",
      "answer": "Your Today habit list is not available to this Coach yet. The Today screen exists in the approved design, not as a connected notebook feature.",
      "intent_id": "TODAY_OVERVIEW"
    },
    {
      "id": "Q-013",
      "category": "Today Overview",
      "question": "Which habits are scheduled today?",
      "answer": "I need verified schedules to identify which habits are due today; those schedules are not connected here.",
      "intent_id": "TODAY_OVERVIEW"
    },
    {
      "id": "Q-014",
      "category": "Today Overview",
      "question": "What have I finished today?",
      "answer": "I cannot confirm what you finished today without saved completion records.",
      "intent_id": "TODAY_OVERVIEW"
    },
    {
      "id": "Q-015",
      "category": "Today Overview",
      "question": "What is still pending?",
      "answer": "I cannot list pending habits without both your schedule and recorded activity statuses.",
      "intent_id": "TODAY_OVERVIEW"
    },
    {
      "id": "Q-016",
      "category": "Today Overview",
      "question": "How much of today is complete?",
      "answer": "Today's completion rate needs verified scheduled and completed activities and an approved denominator rule. I cannot calculate it here.",
      "intent_id": "TODAY_OVERVIEW"
    },
    {
      "id": "Q-017",
      "category": "Today Overview",
      "question": "Am I done for today?",
      "answer": "I cannot confirm that you are done for today without your full verified schedule and completion records.",
      "intent_id": "TODAY_OVERVIEW"
    },
    {
      "id": "Q-018",
      "category": "Today Overview",
      "question": "What should I tackle next?",
      "answer": "I cannot rank remaining habits without your schedule. You could choose a small action that fits the time you have available.",
      "intent_id": "TODAY_OVERVIEW"
    },
    {
      "id": "Q-019",
      "category": "Today Overview",
      "question": "Is reading scheduled today?",
      "answer": "I cannot check whether reading is scheduled today because your reading settings are not connected.",
      "intent_id": "TODAY_OVERVIEW"
    },
    {
      "id": "Q-020",
      "category": "Today Overview",
      "question": "Which habit comes next?",
      "answer": "I cannot identify the next scheduled habit without your schedule. Tell me the options if you want general planning help.",
      "intent_id": "TODAY_OVERVIEW"
    },
    {
      "id": "Q-021",
      "category": "Today Overview",
      "question": "Give me a quick daily summary.",
      "answer": "A verified daily summary needs today's schedule and saved activity records, which are not connected yet.",
      "intent_id": "TODAY_OVERVIEW"
    },
    {
      "id": "Q-022",
      "category": "Today Overview",
      "question": "What did I miss today?",
      "answer": "I cannot label today's activities missed without verified records and an approved day-boundary rule.",
      "intent_id": "TODAY_OVERVIEW"
    },
    {
      "id": "Q-023",
      "category": "Habit Creation Help",
      "question": "How do I create a habit?",
      "answer": "The approved design includes Create Habit with habit details and schedule choices. I can help describe a habit, but cannot create a saved record.",
      "intent_id": "HABIT_CREATION_HELP"
    },
    {
      "id": "Q-024",
      "category": "Habit Creation Help",
      "question": "Can I add a reading habit?",
      "answer": "You can plan a reading habit. Describe the action and a useful cue; I can suggest wording, but cannot add it to your account.",
      "intent_id": "HABIT_CREATION_HELP"
    },
    {
      "id": "Q-025",
      "category": "Habit Creation Help",
      "question": "Where is the add habit option?",
      "answer": "The approved prototype includes a create-habit entry from Today. Production placement is unverified, and this notebook has no add-habit control.",
      "intent_id": "HABIT_CREATION_HELP"
    },
    {
      "id": "Q-026",
      "category": "Habit Creation Help",
      "question": "What details do I need for a new habit?",
      "answer": "The requirements include a habit name, description, category, recurrence, schedule, reminder and start-date configuration. Mandatory fields still need confirmed product rules.",
      "intent_id": "HABIT_CREATION_HELP"
    },
    {
      "id": "Q-027",
      "category": "Habit Creation Help",
      "question": "Can I create a habit without a reminder?",
      "answer": "Whether a habit can be created without a reminder is not confirmed for production. I will not assume reminders are mandatory or optional.",
      "intent_id": "HABIT_CREATION_HELP"
    },
    {
      "id": "Q-028",
      "category": "Habit Creation Help",
      "question": "How do I name my habit?",